{
  "kind": "ApprovalPolicy",
  "enabled": true,
  "provenance": {
    "sourceCommit": "6ff396739f4f8afbf7af966e202a45a00eb0eeaa",
    "independentlyAuthored": true,
    "createdAt": "2026-07-17T12:00:00.000Z"
  },
  "id": "policy.sandbox.validation-notify",
  "name": "Fixed validation command",
  "version": "1.0.0",
  "description": "Allows the fixed local validation command and records a notification decision.",
  "matcher": {
    "toolIds": ["tool.sandbox.command"],
    "stages": ["implement", "verify"],
    "networkAccess": false
  },
  "mode": "NOTIFY",
  "requiredApproverScopes": [],
  "requiredApproverPersonas": [],
  "timeoutSeconds": 600,
  "forbidSelfApproval": false,
  "reasonRequired": false,
  "contentHash": "1787230b8281304bd6a7539b5c5a2f8b2cf09e439a7e043bb3bf7a998dbcf250"
}
