{
  "kind": "ApprovalPolicy",
  "enabled": true,
  "provenance": {
    "sourceCommit": "6ff396739f4f8afbf7af966e202a45a00eb0eeaa",
    "independentlyAuthored": true,
    "createdAt": "2026-07-17T12:00:00.000Z"
  },
  "id": "policy.sandbox.network-deny",
  "name": "Sandbox network access denied",
  "version": "1.0.0",
  "description": "Denies network-enabled sandbox requests in the functional local demonstration.",
  "matcher": { "toolIds": ["tool.sandbox.*"], "networkAccess": true },
  "mode": "DENY",
  "requiredApproverScopes": [],
  "requiredApproverPersonas": [],
  "timeoutSeconds": 300,
  "forbidSelfApproval": true,
  "reasonRequired": true,
  "contentHash": "e4b3c5c0d8e65ae6db836142ad1fa3e8e0f0598b00a6a3e1cf9a5a24ffad7e09"
}
