{
  "kind": "ApprovalPolicy",
  "enabled": true,
  "provenance": {
    "sourceCommit": "6ff396739f4f8afbf7af966e202a45a00eb0eeaa",
    "independentlyAuthored": true,
    "createdAt": "2026-07-17T12:00:00.000Z"
  },
  "id": "policy.release.validator-approval",
  "name": "Release readiness requires validation approval",
  "version": "1.0.0",
  "description": "Requires a distinct validator persona before a release-readiness transition.",
  "matcher": { "toolIds": ["tool.workflow.release-readiness"], "stages": ["review"] },
  "mode": "REQUIRE_APPROVAL",
  "requiredApproverScopes": ["validation:approve"],
  "requiredApproverPersonas": ["synthetic-validator"],
  "timeoutSeconds": 3600,
  "decisionCacheTtlSeconds": 600,
  "forbidSelfApproval": true,
  "reasonRequired": true,
  "contentHash": "a1c5c3bd3532f5b349d2917adf409bd8cba0c176060fc3fb53af0a5f5da87117"
}
