{
  "kind": "ApprovalPolicy",
  "enabled": true,
  "provenance": {
    "sourceCommit": "6ff396739f4f8afbf7af966e202a45a00eb0eeaa",
    "independentlyAuthored": true,
    "createdAt": "2026-07-17T12:00:00.000Z"
  },
  "id": "policy.evidence.finalized-deny",
  "name": "Finalized evidence is immutable",
  "version": "1.0.0",
  "description": "Denies mutation after browser-local evidence is marked final.",
  "matcher": { "toolIds": ["tool.evidence.write"], "evidenceFinalized": true },
  "mode": "DENY",
  "requiredApproverScopes": [],
  "requiredApproverPersonas": [],
  "timeoutSeconds": 300,
  "forbidSelfApproval": true,
  "reasonRequired": true,
  "contentHash": "ab2453c0414f6762ca368a15d4aec40064cc5b5bf45947af6f26d6ef150a171e"
}
